transferdata,custodianaddress,sharestransferred,registerlocation,numbershares,newcertificate,pep,citizenship,ceasedmembership,name,dateofissue,rst,certificateNumber,custodianname,classofshares
Nobis dolorum aut vitae possimus.,"8762 Chastity Roads
West Manuelitaland, NH 24737-2452",0,Western Sahara,7573,False,molestias,Togo,1994-10-06,Coleton Beier,1987-11-30,molestiae,89,Justice Mraz DVM,et
Qui qui magni suscipit consequatur nobis aspernatur.,"Unit 3988 Box 9369
DPO AP 72513",8,Indonesia,0,False,rerum,Syrian Arab Republic,2011-09-28,Rian Feil DDS,1991-06-12,et,2616,Hyman Barrows,quidem
Aliquam sint magnam ipsam occaecati ipsum ipsa.,"7493 Waters Dam
Vinceville, OH 49544-1308",9486,Rwanda,836537,True,commodi,Hungary,2003-09-14,Miss Marvel Lynch MD,1974-10-25,aut,2,Ora Corwin,ullam
Sequi dolore dolor rerum repellat cumque commodi.,"805 Robbin Lights
Kayleemouth, GU 63246",552912777,Guinea,156686,True,quia,Uruguay,1973-10-01,Miss Rosey Sporer MD,1996-07-13,et,565,Nichol Kuhlman,officia
Et qui quos corrupti nobis nemo sint velit.,"55657 Yair Cove Suite 672
East Loniton, ME 37733-5780",552,Cape Verde,1,False,eveniet,Sudan,1988-02-09,Elden Jones,1998-10-28,illum,0,Ms. Breanna Mann,perspiciatis
Qui nostrum dolorem adipisci voluptatem.,"115 Wilbur Ford
Port Dolphstad, WV 53163",9575789,Guinea-Bissau,48621404,False,occaecati,Singapore,1983-06-18,Kristofer Moore,1977-01-25,qui,0,Isham McLaughlin,expedita
Saepe ut quos neque excepturi laboriosam.,"6518 Cremin Trace Suite 153
Mosciskiborough, KY 40086",25968560,Andorra,7749,False,eos,Niger,1971-04-06,Madden Carter,2006-07-03,placeat,0,Lonnie Kemmer,sed
Et ut sit non totam sint et.,"97667 Mohr Parkway
Marcellatown, OH 23744",572676,Jamaica,4244,False,ut,Ghana,1982-11-15,Vira Bogan,1970-02-28,maiores,7211152,Tressie Satterfield,sint
Voluptas omnis odit odit earum rerum.,"776 Amanda Trail
Corystad, MT 24941",609,New Caledonia,3176,True,dolor,Maldives,2002-03-04,Mr. Romeo Rohan,1983-10-17,rerum,20596652,Mr. Mortimer Marks,ab
Voluptatem dolorem recusandae dolorem voluptatibus temporibus vitae sunt distinctio.,"42131 Zoie Ports
South Theodismouth, GA 68843",125571424,Slovenia,1,True,assumenda,Cook Islands,2008-02-29,Marilyn Dare,1971-08-13,reiciendis,839,Tommie Franecki,sit
Omnis et magnam quos cumque sunt eligendi.,"91826 Gibson Trail
Gingerton, VA 96642-8282",77028,Germany,68477285,False,possimus,Sierra Leone,1992-07-19,Arlan Marvin IV,1978-06-12,commodi,48,Alvia Torphy,aut
Laborum aut eligendi repellat aperiam voluptatum soluta eos voluptates.,"Unit 5991 Box 1351
DPO AE 34326",862,Tajikistan,861343261,True,tempora,Bosnia and Herzegovina,1985-07-24,Winthrop Kshlerin DDS,1989-03-22,quis,91954,Domonique Ritchie,autem
Natus natus vel id iste placeat tenetur.,"5625 Johns Stravenue
New Hilmaborough, WV 62679-3948",28,Maldives,6,True,at,Gambia,2001-10-03,Daniel Haag,2010-10-06,commodi,1544,Vinton Hilpert,sed
Aut aut beatae voluptatibus nam omnis dolore.,"1154 Annmarie Unions
Roobbury, VI 00840-2506",176501493,El Salvador,6656,True,voluptas,Slovakia (Slovak Republic),2000-11-05,Emilee Hills,2009-08-29,in,252798,Pershing Kovacek,temporibus
Molestiae ex accusamus doloremque odit minus.,"63992 Kuhn Prairie
South Cinda, AS 94642-1203",94707963,Turks and Caicos Islands,440,True,molestias,Montenegro,2015-12-06,Dr. Orris Heaney,1984-06-15,tenetur,99130,Wilburn Feil,eius
Nemo eum nihil reprehenderit.,"Unit 9334 Box 3735
DPO AA 96499",3,Antarctica (the territory South of 60 deg S),2832065,False,sunt,Papua New Guinea,2015-11-05,Clevie Heathcote PhD,1999-05-12,voluptatibus,62860,Bill Cronin,sapiente
Voluptate occaecati occaecati dolores qui eius.,"1844 Quigley Dale Apt. 845
Pollychester, PR 45161",3371492,Namibia,12,False,illo,Afghanistan,2011-08-09,Dr. Anaya Schroeder,1999-02-12,necessitatibus,8606,Mrs. Candis Legros PhD,harum
Voluptate eos ipsum laborum animi non ut minima.,"545 Ortiz Viaduct
Mooreport, HI 55809-1801",84,Central African Republic,0,False,velit,Qatar,1989-02-01,Miss Alexis Kutch DDS,1985-05-08,quas,7,Torry Ratke,suscipit
Eum amet impedit culpa iure ullam culpa.,"2738 Lilburn Junctions
West Oralview, UT 66383",7,Oman,492,False,error,Antigua and Barbuda,2005-03-05,Wirt Moore III,1974-02-17,magni,0,Jenelle Johnston,itaque
Repellat vel eos et qui natus asperiores dolor sequi.,"864 Kris Village
New Shannon, NE 83044-5663",4793929,Northern Mariana Islands,8569,False,veritatis,Seychelles,1994-03-07,Adlai Yost,2003-05-24,et,30,Kirby Ferry,dolorem
Eum delectus quia ab corporis repudiandae voluptas deserunt.,"0670 Milton Ridges
Boganfurt, LA 94275-2534",295998528,Nepal,573599459,False,dolor,Belgium,1990-10-12,Jasmyne Wilkinson,1977-02-28,voluptas,8103751,Lannie Kozey IV,sint
Cupiditate nostrum ut ut.,"5698 Price Motorway Apt. 068
New Wilsonhaven, SC 67868-0664",1308,Senegal,0,False,mollitia,Japan,1990-03-03,Mr. Arnav Breitenberg DVM,1988-03-30,nulla,9,Dr. Nat Ziemann,quia
Reprehenderit consequatur quo sapiente.,"74437 Kreiger Creek Apt. 860
Makaylachester, DE 48876",76,Malaysia,657140,True,soluta,Saint Vincent and the Grenadines,2000-08-25,Roswell O'Keefe,1985-11-21,commodi,0,Dr. Tod Schneider,consectetur
Minima harum quia error perspiciatis saepe accusantium.,"PSC 4846, Box 8894
APO AE 53401-0573",971885919,Saint Helena,54221490,True,hic,France,2002-08-02,Estill Kertzmann,1990-11-13,corporis,0,Ronin Schroeder,est
Dolorem accusantium quas itaque nihil.,"7986 Barrows Fort
Keeblermouth, MT 28080-6231",785266322,Micronesia,2030,False,facere,Yemen,2003-08-11,Ethan Nikolaus,2008-01-11,autem,105739372,Dr. Camilo Keebler II,exercitationem
Deleniti et molestias quia repellat expedita quia.,"0558 Haag Radial Suite 268
Lake Santina, IA 59544-6561",665,Tajikistan,5,False,ut,Guam,1983-05-27,Nova Beahan,1978-01-13,cumque,5365598,Mac Fadel,dolor
Veritatis ab officiis nihil et quisquam.,"965 Avery Burgs Apt. 259
Port Electa, PR 64134-2242",8987,Reunion,80,False,dolorem,Panama,1999-11-11,Arielle Kub,1970-11-29,omnis,0,Hartwell Beatty,molestiae
Eius iusto veniam doloremque reiciendis.,"23370 Laddie Inlet
Wessstad, AZ 50825-8403",9,Vanuatu,27,True,nesciunt,Mali,2015-03-05,Dr. Michial Greenholt Sr.,2008-08-14,impedit,496,Aili Shields PhD,veniam
Qui cumque animi dicta temporibus consequuntur soluta.,"87924 Belle Burg Suite 043
North Alessandro, GA 92931",807,Luxembourg,385130713,True,velit,Cyprus,1991-12-30,Kaylan Buckridge PhD,1990-10-28,natus,282707146,Ms. Sophie Langworth,nemo
Qui voluptate dicta pariatur vel.,"478 Moody Plains Apt. 028
Rosenahaven, MS 47019",2,Uruguay,9076318,False,voluptates,Chad,1988-10-21,Milissa Huel DDS,2000-02-08,facilis,826654656,Archer Mueller,qui
Neque dolor eveniet voluptatem a.,"5756 Love Mills
Ikestad, PW 56352-9827",0,Isle of Man,565884308,False,eligendi,Burkina Faso,1999-09-16,Harlan Schultz,2015-06-29,est,77840392,Denisse Larson,optio
Unde sed natus adipisci molestias iusto eaque.,"285 Boehm Rapids
Aufderharborough, ND 19312",0,Palau,0,False,quod,Burundi,1989-10-07,Arley Casper,1989-11-15,saepe,44772923,Elbridge Grant,autem
Laboriosam aliquid harum voluptate tempore rem aliquam.,"377 Ethan Brooks Suite 380
East Bianca, MH 31158",92322,San Marino,258174,False,voluptatum,Fiji,1988-12-01,Orval Steuber,1975-06-14,omnis,0,Carey Medhurst,repellendus
Porro consectetur et quis reprehenderit vel tenetur aperiam.,"15569 Fallon Garden Suite 257
South Vernellchester, UT 71484-8240",0,Saint Kitts and Nevis,57,True,consequatur,India,1990-04-08,Harper Macejkovic,1974-07-24,veniam,2671130,Dr. Chauncey Anderson,consectetur
Voluptatem incidunt quo et aspernatur.,"78521 Kerluke Road
South Katlynn, NV 27400",1,Pakistan,6,True,ut,Cape Verde,2008-05-30,Bartley Predovic MD,1971-10-26,velit,91,Olga Heidenreich,rerum
Perspiciatis enim laboriosam sunt in.,"7565 Nana Rapid Suite 800
Darlineburgh, NH 57307-0846",63,Burundi,61950,True,sit,Bulgaria,2013-10-16,Floretta Brown,1988-09-16,necessitatibus,443028332,Mr. Kevin Huels,molestiae
Reprehenderit rerum quam vitae autem ea sed.,"0360 Estell Falls Apt. 598
West Charissa, FL 92644",0,Cyprus,1038,False,perspiciatis,Zimbabwe,1973-06-14,Garrick Rau Sr.,1998-02-01,facilis,0,Kayli Kihn,omnis
Est excepturi qui consectetur cum maxime nesciunt.,"595 Stephania Village
Monahanland, ID 29401",483022045,Iraq,84951068,True,consectetur,Netherlands Antilles,1975-10-03,Lenard Pouros,1970-09-11,dolores,457442396,Linda Reilly,eius
Voluptas minus doloribus occaecati aut voluptate.,"64803 Borer Village Apt. 795
Port Weldon, PW 39813",584,New Caledonia,5744,True,praesentium,Uzbekistan,2013-10-18,Bedford Hettinger,1985-02-26,repudiandae,0,Casimir Hansen,saepe
Perferendis et aut dolorem dolorem.,"15871 Conroy Stream Suite 122
East Asher, AL 96136",0,Namibia,3,True,est,Turks and Caicos Islands,1986-10-31,Judy Schaefer,1995-08-13,quia,2,Marlene Koss,architecto
Ut autem iusto qui repellat quidem.,"491 Dot Circles
Grahamtown, NY 95209-2415",53992314,Congo,8959,True,et,Anguilla,1992-04-17,Dr. Danniel Stracke,1994-08-15,odit,977,Delmus Raynor,officia
Nemo at quod recusandae quia dolorem temporibus.,"918 Koelpin Tunnel
Ornville, UT 63448-6336",4424,American Samoa,11778471,True,eos,Macao,1977-07-05,Ovila Wehner,1987-09-21,rem,97363972,Mrs. Bryana Deckow PhD,voluptatem
Aut aut a magni rerum corrupti.,"9595 Alonso Lane Apt. 318
Kuhicville, KS 81831-6044",84595252,Ukraine,8,False,cum,Korea,1972-10-17,Marlon Casper,2015-04-04,soluta,137215,Jabbar Anderson,eveniet
Rerum illum in voluptatem.,"061 Hagenes Club Apt. 595
Lake Carleneland, MO 72626-1284",246,Guam,7850747,True,quos,Pitcairn Islands,1997-03-20,Dr. Lucious Senger DVM,1995-05-19,et,429,Braelyn Borer MD,aliquam
Temporibus natus velit et nemo.,"4131 Wiegand Shore
Kohlerhaven, HI 95653-1443",33148,Greenland,277352,False,similique,Cuba,1974-11-21,Kassandra Reichel,1997-12-14,iure,2594,Florida Douglas,odit
Necessitatibus iure laboriosam voluptas dolores a.,"9422 Dooley Union Suite 560
Lake Feleciaton, ND 52617",0,Thailand,3998,False,illum,Eritrea,1985-07-27,Miss Jordan Muller,2005-12-27,est,17,Mrs. Debera Baumbach DDS,culpa
Est tempora ipsa ut quisquam voluptas mollitia.,"398 Tatum Wall Apt. 862
Mykelburgh, IN 80701-1337",35378147,Tanzania,47268623,True,quod,Belize,1975-10-07,Neta Balistreri,1975-10-02,numquam,874097,Dr. Hershell Connelly,animi
Dolorem minima qui adipisci eum debitis nostrum.,"175 Pheobe Corner Apt. 146
Lake Allaland, TN 12248",756134443,India,0,False,aliquam,New Caledonia,1983-05-26,Miss Audrey Ondricka DDS,1977-11-08,sit,0,Jaylah Harvey,ipsum
Illum consequatur quis aut vel illum commodi et hic.,"USS Torphy
FPO AP 06785-4360",48008491,Niue,35686,True,laborum,Kenya,2011-09-18,Mrs. Brittny Jacobs,1983-01-10,maxime,3687,Jayde Dooley,eum
Est officiis animi fuga odio ut voluptas ipsa.,"4503 Claud Ports
Lavoniaton, AZ 03546-5198",5,Seychelles,266,False,error,Bahamas,1984-12-30,Yesenia Flatley,1970-11-20,quis,6,Adrian Tremblay DVM,reprehenderit
Quis sequi quis eum aut consectetur.,"6922 Sauer Meadow
Port Toyland, FL 16072-6193",135418,Oman,11279,False,sed,Finland,1992-12-17,Karis Glover,2015-12-06,quia,69591,Americo Harris,minima
Est eos eos est culpa maxime perspiciatis.,"84304 Gerlach Circle
West Latriciamouth, CT 24385",19439,Switzerland,5396235,True,ut,Thailand,2001-02-21,Kaylan Kuphal,2008-12-11,incidunt,42401,Jeane Sanford,labore
Non quas beatae doloremque dicta.,"674 Sipes Track Suite 787
East Guy, PR 28378-3570",3,Belgium,639,False,at,Macao,2005-02-13,Julia Collier,1989-09-05,impedit,32803,Pallie Romaguera DVM,tempore
Voluptatem velit odio sed ipsa et eveniet vel.,"18365 Koch Court
Antoniahaven, VA 17959",29,Tuvalu,0,False,libero,Madagascar,2002-09-17,Mr. Stone Kirlin Sr.,1985-06-12,voluptatem,9817,Arlis Willms,delectus
Sequi ipsum voluptatibus neque sunt consectetur facere facere non.,"527 Inga Hill
Port Yaelstad, RI 08794-0348",7,Micronesia,21167429,False,voluptatum,Croatia,2008-07-15,Ab Zulauf II,1981-07-27,dolor,278,Ludie West,porro
Sed facere facere odio quia.,"3382 Flatley Meadows
Mertzburgh, VI 77890",7591307,Egypt,0,True,fuga,Turks and Caicos Islands,1993-09-23,Alanzo Hermiston,2009-06-02,nostrum,36,Alferd Lockman I,enim
Fuga dolorem quo quam iusto et dolorem.,"915 Lilian Springs Suite 693
North Noah, GA 74807",87,Isle of Man,240173,False,sint,Gambia,1976-01-01,Suzanne Hayes,1988-07-09,rerum,865950,Miss Dola Wiegand MD,officiis
Veniam itaque laborum ducimus neque doloribus.,"95267 Marvin Gardens
Port Brynfort, PA 59940",523,Suriname,0,True,aspernatur,Australia,1970-03-27,Carnell Lang,1995-07-12,fugiat,6,Louann Murazik,nihil
Esse architecto consectetur est officia qui optio.,"218 Nereida Roads Suite 265
East Jeromefurt, MH 78084",1,Cameroon,207648673,False,omnis,Burkina Faso,2004-11-17,Dr. Delbert Mertz V,2012-12-18,praesentium,8,Ceasar Ullrich DVM,soluta
Id fugiat impedit est odit maxime.,"9417 Marisela Wall Apt. 154
Joellebury, PW 59630-4309",0,New Caledonia,6,True,nostrum,Guadeloupe,1991-07-23,Hilliard Torp,2011-04-03,rerum,118852248,Ms. Pamala Klocko,explicabo
Est rem a sapiente et.,"47028 Sharen Plains Suite 338
North Morgan, KS 68909",627589,United States of America,29491137,True,commodi,United Kingdom,1981-07-05,Curtis Rempel IV,1971-05-06,itaque,118033,Althea Willms,eaque
Tempora voluptatum vel natus accusamus rem nam.,"88664 Antonina Glens Suite 442
New Everettmouth, CO 15884-0221",658895,Barbados,20693,False,vel,Belgium,1989-10-25,Mrs. Journey Jaskolski MD,2012-06-12,quo,107860,Ferdinand Kris,aliquam
Voluptas assumenda mollitia deleniti odio.,"74281 Tyshawn Wells
East Mathborough, RI 96653",2,Finland,73059,False,facilis,Namibia,2008-03-21,Emilie Huel,1998-11-20,sit,84908,Governor Jenkins Jr.,ab
Esse aperiam aut rem rerum qui iure.,"367 Yost Mills Apt. 450
Port Mervyn, MH 38087",7184444,Kiribati,0,False,eaque,Iran,2011-11-12,Sage Rowe,2002-07-06,quasi,28638,Randolf Lockman,autem
Ea natus quae fugiat ad aut laudantium.,"0288 Katharyn Ports Apt. 818
Dontaechester, CA 54275-3571",617379743,Czech Republic,643285,False,ea,Guam,1996-12-14,Waylon Larson,2006-11-29,quidem,86732104,Romeo Trantow,non
Consequatur velit totam et id.,"74199 Walker Fords
Jettaland, WA 65985",3416,Bangladesh,544,False,adipisci,Myanmar,2009-05-15,Gifford Bergnaum,2000-11-22,voluptatem,931,Foch Jacobi,laudantium
Atque consequatur cumque corporis.,"359 Quigley Islands Suite 416
Dellhaven, OK 03024",0,Mauritania,9346110,False,nihil,Romania,2012-06-22,Shawnte Lueilwitz,2013-11-29,asperiores,44,Dr. Consuela Bernier,in
Sequi totam id quae.,"673 Stamm Plain Suite 767
Port Layla, DE 25262-6908",604,Vietnam,3031980,False,officiis,American Samoa,1988-06-09,Dr. Laron Corkery Jr.,2015-04-26,neque,0,Elza Berge,sunt
Accusantium cupiditate inventore voluptas enim quas porro.,"06615 Walter Branch
South Jazlynville, KS 60683",39,Nepal,8106,False,ipsam,Papua New Guinea,2011-06-12,Corine Osinski,2000-04-27,consequatur,9430,Mr. Ocie Feeney,laborum
Cupiditate rem consectetur ipsum.,"26684 Eric Gateway Suite 561
Angelesborough, MH 57439",1052055,Zambia,14527192,True,veniam,Macedonia,2011-06-21,Benjiman Purdy,1997-10-22,praesentium,10,Eleanor Breitenberg PhD,inventore
Libero iste qui itaque suscipit fugit aut asperiores.,"975 Gerry Glens
Lake Gertieport, IN 42670-0234",776,Bangladesh,5,False,occaecati,Denmark,2013-01-17,Astrid Heidenreich,2006-11-01,hic,376,Mrs. Cinda Miller,laudantium
Dicta quia voluptatem sapiente iste numquam.,"82672 Evelena Street
New Mell, CA 83263",82730562,Kenya,939,False,soluta,Antigua and Barbuda,1983-10-02,Donell McCullough Jr.,2009-08-08,et,0,Benny Little,qui
Sit autem at eius ut quos quaerat veniam.,"USS Bernhard
FPO AA 16567",62,Cocos (Keeling) Islands,257408,False,omnis,Angola,2003-10-05,Jamya Miller,2004-09-20,in,428105527,Lincoln Heidenreich,sit
Dolores molestiae ut consequatur sint vel ullam omnis iste.,"2819 Robin Trail
Stehrhaven, MA 16442",65817325,Belarus,990,True,deserunt,Holy See (Vatican City State),1992-12-25,Laquan Crist,2011-05-27,eum,151487,Austin Kassulke,dolore
Qui autem est dicta dolores sequi quis id.,"6317 Nonie Union Suite 052
Michelinafurt, VA 92306-6533",113517,Bolivia,48,True,maiores,Israel,1988-05-24,Dr. Fielding Gerlach IV,1975-07-19,eos,63,Kanye Yost,mollitia
Sed enim at autem aut est.,"2860 Clarisa Walks
Hettingerview, RI 18342",7959,French Polynesia,3941177,True,et,Uruguay,1973-06-19,Ms. Kala Bartell,1986-09-15,possimus,329,Elizabeth Ortiz,atque
Quia quia culpa voluptatem minima quam aut.,"859 Jennifer Rue
Port Caitlinmouth, MI 34383",4833,Korea,30034,True,sit,Zambia,1977-10-26,Dr. Arne Raynor II,1987-12-27,quia,733106365,Marco Gerhold Sr.,suscipit
Dolorum exercitationem omnis blanditiis qui doloremque voluptate eius unde.,"29825 Mabell Lights Suite 276
Lynchton, SD 40751-7834",7675,Rwanda,1,True,omnis,Australia,1999-11-09,Jalen Berge V,1999-12-17,qui,0,Danniel Toy,similique
Rerum sit error rerum.,"14535 Jewess Pike
Greenfelderberg, HI 22495-3900",880082056,Ecuador,50866375,False,facilis,Mauritania,2002-03-06,Bo Hills,1973-12-28,omnis,8953,Sarah Rosenbaum,fugit
Et consequatur sint aut fuga dolores.,"042 Tillman Port
Oswaldoview, MN 12891",0,Western Sahara,923719,False,debitis,Niger,1970-12-07,Osborn O'Connell,2004-09-23,in,46300,Dr. Barrett Fay,sed
Est harum ad praesentium vel et excepturi aliquam.,"928 Lonie Gateway
Volkmanbury, MD 52163-6111",5,Syrian Arab Republic,12139,True,natus,Ethiopia,1999-08-29,Ethelbert Rodriguez,1974-07-03,eveniet,5043,Penni Keebler,sint
Officia nihil iusto explicabo qui.,"87276 Doug Station
New Sade, TX 80289",977244,Reunion,7106038,False,magni,Monaco,1996-01-01,Myrtle Nolan,1987-05-08,nisi,78827176,Zaniyah Gottlieb PhD,nesciunt
Delectus quae quia repellat enim blanditiis.,"70490 Waelchi Junction Suite 446
North Winona, HI 82536",6435010,Armenia,46998,True,quia,Mauritius,1988-04-02,Jeana DuBuque,1977-11-02,voluptatem,107430910,Lita Ruecker,sint
Provident voluptatem velit eaque hic nihil nobis distinctio.,"322 Joaquin Streets
Lake Hardy, MN 30099",25774,Venezuela,801374851,True,non,Bahamas,1974-12-05,Ora Glover,2015-03-20,dolor,0,Chelsi Dicki,et
Veniam et possimus omnis et magnam iusto totam.,"869 Hessel Dale
Bartolettimouth, NV 85558-9342",90,Russian Federation,3324,False,provident,Spain,1993-06-29,Leonel Terry,1984-09-09,voluptatibus,6109359,Stanford Morissette,maxime
Molestiae sit quia odio ut dolorem laborum laboriosam autem.,"USS Satterfield
FPO AP 28797",0,Jordan,6779,False,illo,United Arab Emirates,1991-04-28,Daniel Green,2008-09-05,perspiciatis,5313,Isaiah Collins,quis
Esse beatae est laborum veniam.,"6749 Etter Mews
Port Jerrica, UT 59329",70484,Cocos (Keeling) Islands,9011927,False,omnis,Solomon Islands,1998-06-03,Elta Hessel,1999-03-20,nisi,78,Steve Beer,in
Recusandae et id dolorum.,"610 Beahan Mills
Earlfurt, DE 79648",0,San Marino,8281388,False,sit,Zimbabwe,1999-02-18,Cristine Kuhlman,2013-07-09,ea,1096835,Jeramy Runte I,quos
Et consequuntur dolor vel id aliquid nostrum.,"88457 Phillis Station
East Theodosia, AR 09407-5701",590505642,El Salvador,74061188,False,quod,Suriname,1973-01-20,Jalyn Kulas,1995-10-01,magni,45455,Mareli Legros,laboriosam
Sit dolorem et mollitia vero omnis.,"8051 Kub Lock
Lake Ramona, WY 50262-5538",3,Tokelau,95521010,False,fuga,Heard Island and McDonald Islands,1990-02-17,Mr. Arvid Dickens III,1974-10-15,sequi,0,Mr. Demarcus Jakubowski,et
Consequatur laborum consequatur eius delectus.,"70336 Else Circles
Smithstad, NJ 51251-8864",5,Albania,0,False,ipsum,Saudi Arabia,2010-10-22,Chauncey Barton,2001-05-28,ab,0,Rylie Gleichner,autem
Et ea deleniti deleniti non beatae delectus ut.,"114 Kutch Lodge Apt. 865
Hellerfurt, AK 76313",0,Mauritius,13316398,False,autem,Pitcairn Islands,2011-10-08,Ms. Jacklyn Legros DVM,1971-08-07,et,51,Juan Lemke,accusantium
Quia asperiores quidem ut aperiam.,"4532 Marleigh Plains
North Mendyfort, CO 31249",6584,Suriname,13166,True,voluptatum,Solomon Islands,1976-01-20,Chadrick Runolfsdottir I,2009-11-18,iusto,273216831,Ryne Buckridge,eaque
Eum temporibus magni corrupti impedit magni eligendi ea.,"16993 Nat Forges
Lake Dosha, ME 01086-2555",180137,Djibouti,214,False,praesentium,Somalia,1985-03-19,Cary Hansen,1998-07-25,fugit,217,Simpson Prohaska,a
Aut ipsa ipsam eligendi aut.,"1582 Lyndon Wells Apt. 075
South Jamey, MI 13687",6,Dominica,713,True,maiores,Singapore,1994-05-18,Jerimy Carroll,1998-12-12,in,23827934,Ms. Keara Murphy DDS,in
Quis quasi tenetur occaecati et illo.,"3792 Huel Lodge Suite 899
Kayleemouth, VI 71674-8557",54,Canada,208966,True,voluptas,Haiti,2014-12-02,Chelsi Watsica,1979-12-26,blanditiis,208699242,Edson Wiegand PhD,quidem
Architecto omnis provident libero doloremque hic.,"265 Colleen Rest Apt. 603
Cassieburgh, AS 34518",965,Algeria,23,False,praesentium,Uganda,2003-01-03,Reagan Mueller,2004-03-28,id,11074,Miss Staci Homenick DVM,pariatur
Possimus enim et quis eum quasi cupiditate unde.,"158 Maddux Club
North Lawandaland, FL 38592",1683,Armenia,7868,False,ut,Colombia,1981-04-21,Gordon Hamill,1991-07-11,minus,46408838,Mrs. Shyla Bayer,voluptas
Molestias voluptas cumque ab rerum.,"5698 Wilburn Vista Suite 643
East Cristophershire, RI 87049-6670",52528906,Turks and Caicos Islands,684,True,nostrum,Japan,1970-03-13,Jan Johnson,1971-05-04,magnam,52603,Rhiannon Senger,veniam
Quia sit magni modi.,"982 Ethelyn Falls Suite 120
East Cindyview, AZ 53036-6660",8,Austria,446,True,doloribus,Antigua and Barbuda,1987-01-04,Dr. Thaddeus Walsh DVM,2000-08-30,dolor,28,Tyrus Robel,ab
